{
  "publication_id": "pub_example_001",
  "platform": "instagram",
  "account_id": "account_example_001",
  "asset_ref": "asset_example_001",
  "published_at_utc": "2026-09-08T12:00:00Z",
  "format": "video",
  "character": "hero",
  "circle": "fitness",
  "status": "published",
  "experiment_id": "exp_example_001",
  "hypothesis_id": "hyp_example_001",
  "meta_post_id": "meta_post_example_001"
}
