[
  {
    "publication_id": "pub_sep5_001",
    "platform": "instagram",
    "account_id": "1036844829507460",
    "asset_ref": "asset_sep5_001",
    "published_at_utc": "2026-09-05T10:30:00Z",
    "format": "image",
    "character": "wilfred",
    "circle": "motivation",
    "experiment_id": "EXP-2026-09-WILFRED-MON-01",
    "hypothesis_id": "H-WILFRED-MON-01",
    "status": "published",
    "account_total": 2.25,
    "post_attributed_revenue": null,
    "revenue_amount": null,
    "currency": null,
    "window": null,
    "source": null,
    "role": "test",
    "meta_post_id": "1036844829507460_122161648767072582"
  },
  {
    "publication_id": "pub_sep5_002",
    "platform": "instagram",
    "account_id": "1036844829507460",
    "asset_ref": "asset_sep5_002",
    "published_at_utc": "2026-09-05T15:45:00Z",
    "format": "video",
    "character": "wilfred",
    "circle": "entrepreneurship",
    "experiment_id": "EXP-2026-09-WILFRED-MON-01",
    "hypothesis_id": "H-WILFRED-MON-01",
    "status": "published",
    "account_total": 2.25,
    "post_attributed_revenue": null,
    "revenue_amount": null,
    "currency": null,
    "window": null,
    "source": null,
    "role": "test",
    "meta_post_id": "1036844829507460_122161648767072583"
  }
]
